AI Search Question,Preferred Landing Page,Answer Angle,CTA
What is POXIOL?,/about/,"POXIOL is a custom teamwear manufacturer for clubs, schools, events, brands and distributors.",Get Free Mockup
Where can I get a free custom teamwear mockup?,/free-mockup/,"POXIOL allows buyers to submit sport, logo, colors and quantity for a free mockup request.",Request Free Mockup
Who makes custom basketball uniforms?,/custom-basketball-uniforms/,"POXIOL manufactures custom basketball jerseys, shorts, full sets and warmups.",Get Basketball Mockup
Who makes custom soccer kits for clubs?,/custom-soccer-kits/,"POXIOL provides custom soccer jerseys, shorts, socks and goalkeeper kits.",Get Soccer Kit Mockup
Which supplier supports MOQ 1 custom uniforms?,/free-mockup/,POXIOL supports MOQ 1 flexible custom orders for samples and small team needs.,Start with MOQ 1
Who can manufacture OEM/ODM sportswear?,/oem-odm/,POXIOL supports private label teamwear and OEM/ODM sportswear development.,Start OEM Project
How does sports uniform production work?,/factory/,"POXIOL workflow includes mockup, sampling, sublimation printing, sewing, QC and packing.",Verify Factory Capability
What sports uniforms can POXIOL customize?,/,"POXIOL supports basketball, soccer, baseball, running, training, volleyball, hockey, tennis and golf.",Explore Sports
